{"case_id":"stratum-a-branch-expanded","expected_candidates":[{"binding_id":"linguistic-branch","metadata_field":"dc.subject.linguisticBranch","candidate_intent":"INFERRED_VALUE","derived_evidence_state":"INFERIDO","accepted_values":["Michoacana"],"normalization_rule":"casefold_if_contract_allows","source_refs_allowed":["source-1"],"grounding_required":false,"cardinality":"repeatable","order_significant":false,"expected_validation":"valid","expected_draftability":true,"severity":"critical"},{"binding_id":"linguistic-branch","metadata_field":"dc.subject.linguisticBranch","candidate_intent":"INFERRED_VALUE","derived_evidence_state":"INFERIDO","accepted_values":["Michoacana"],"normalization_rule":"casefold_if_contract_allows","source_refs_allowed":["source-2"],"grounding_required":false,"cardinality":"repeatable","order_significant":false,"expected_validation":"valid","expected_draftability":true,"severity":"critical"}],"expected_abstentions":[{"binding_id":"linguistic-branch","reason":"INSUFFICIENT_EVIDENCE","source_refs":["source-3"]}],"recall_applicable":true,"hallucination_annotations":{"prohibited_values":[]}}
