{"case_id":"stratum-a-variant-expanded","expected_candidates":[{"binding_id":"linguistic-variant","metadata_field":"dc.subject.linguisticVariant","candidate_intent":"INFERRED_VALUE","derived_evidence_state":"INFERIDO","accepted_values":["Cañada de los Once Pueblos"],"normalization_rule":"unicode_whitespace","source_refs_allowed":["source-1"],"grounding_required":true,"grounding_policy":"range_within_gold","accepted_grounding_ranges":[{"source_id":"source-1","start":0,"end":141}],"cardinality":"repeatable","order_significant":false,"expected_validation":"valid","expected_draftability":true,"severity":"critical"}],"expected_abstentions":[{"binding_id":"linguistic-variant","reason":"GEOGRAPHIC_DISTRACTOR","source_refs":["source-2"]},{"binding_id":"linguistic-variant","reason":"CONFLICTING_EVIDENCE","source_refs":["source-3"]}],"recall_applicable":true,"hallucination_annotations":{"prohibited_values":["Lago"]}}
