{"case_id":"seed-registered-language","expected_candidates":[{"binding_id":"registered-language","metadata_field":"dc.description.registeredLanguage","candidate_intent":"INFERRED_VALUE","derived_evidence_state":"INFERIDO","accepted_values":["Purépecha"],"normalization_rule":"casefold_if_contract_allows","source_refs_allowed":["source-1"],"grounding_required":false,"cardinality":"repeatable","order_significant":false,"expected_validation":"valid","expected_draftability":true,"severity":"critical"}],"expected_abstentions":[],"recall_applicable":true,"hallucination_annotations":{"prohibited_values":[]}}
