{"case_id":"seed-linguistic-variant","expected_candidates":[{"binding_id":"linguistic-variant","metadata_field":"dc.subject.linguisticVariant","candidate_intent":"INFERRED_VALUE","derived_evidence_state":"INFERIDO","accepted_values":["Cañada de los Once Pueblos"],"normalization_rule":"unicode_whitespace","source_refs_allowed":["source-1"],"grounding_required":false,"cardinality":"repeatable","order_significant":false,"expected_validation":"valid","expected_draftability":true,"severity":"critical"}],"expected_abstentions":[],"recall_applicable":true,"hallucination_annotations":{"prohibited_values":[]}}
